{
  "event_id": "example",
  "timestamp_utc": "2026-07-15T00:00:00Z",
  "timestamp_local": "example",
  "date_local": "example",
  "category": "example",
  "action": "example",
  "status": "started",
  "duration_ms": 0,
  "tool": "example",
  "run_id": "example",
  "span_id": "example",
  "parent_span_id": "example",
  "platform": "example",
  "process_id": 1
}
